{
  "macId": 2831052,
  "karsilasma": "Neom SC - AL Hazem FC",
  "bahisTuru": "CIFTE_SANS_1X",
  "secim": "1X",
  "oranDegeri": 1.22,
  "riskPuani": 31,
  "guvenPuani": 72,
  "riskSeviyesi": "DUSUK",
  "gerekce": "Ev sahibi tarafinda oran, takim gucu ve yorum sinyali uyumlu. Cifte sans secimi risk azaltir.",
  "uyarilar": [
    "Bahis onerisi kesin sonuc garantisi degildir."
  ]
}
